{
  "schema_version": "controlled-contract-component-exclusion-applicability.v2",
  "profile_id": "proof.design.implementation-readiness",
  "profile_version": "4.0.0",
  "profile_digest": "d5f489c4ed9ed870c20771f51af5fe8c9e7597b8d5584e52062afb867e81eff6",
  "admission_digest": "1039f7fed8c57417786cc7bb2757515e07f4d8cef3ada8de64651b438382bd54",
  "components": [
    {
      "selector": {
        "kind": "claim",
        "component_id": "design-names-grounded-loci"
      },
      "exclusion_ids": [
        "authored-population-truth",
        "grounded-identity-existence",
        "omitted-authored-requirement",
        "product-sufficiency",
        "runtime-and-repository-truth",
        "warning-runtime-execution"
      ],
      "applicable_exclusion_ids": []
    },
    {
      "selector": {
        "kind": "claim",
        "component_id": "warning-shape-verification"
      },
      "exclusion_ids": [
        "authored-population-truth",
        "grounded-identity-existence",
        "omitted-authored-requirement",
        "product-sufficiency",
        "runtime-and-repository-truth",
        "warning-runtime-execution"
      ],
      "applicable_exclusion_ids": [
        "warning-runtime-execution"
      ]
    }
  ]
}
